{
	"$schema": "https://raw.githubusercontent.com/shiptest-ss13/Shiptest/master/_maps/ship_config_schema.json",
	"map_name": "Grand Tourer-Class Recreational Vehicle",
	"prefix": "ISV",
	"namelists": ["NV"],
	"map_short_name": "GT-class",
	"map_path": "_maps/shuttles/shiptest/independent_hotrod.dmm",
	"job_slots": {
		"Passenger": {
			"outfit": "/datum/outfit/job/independent/assistant",
			"slots": 2
		}
	},
	"enabled": true
}
